{
  "analysis": {
    "macro_micro_separate": true,
    "primary_population": "FULL_COMMON_CANDIDATE_UNIVERSE_NOT_SELECTED_TEN",
    "subgroup_dimension": "market_segment",
    "subgroup_values": [
      "A",
      "B",
      "C",
      "UNKNOWN"
    ],
    "temporal_unit": "ROUTE_DAY_CHRONOLOGICAL",
    "uncertainty_status": "NOT_EMPIRICALLY_ESTIMABLE"
  },
  "bindings": {
    "baseline_benchmark_sha256": "c932f637f9476b03bb5694dcfa8d01c55a67aef8dff59befb4c44a31c427e776",
    "baseline_registry_sha256": "643021f63f0749098a6d89f646d6679b9ce37b67f20af600294117c7fe95033f",
    "baseline_run_sha256": "504f42bb36bee7cb537f7c253eb21aa5d254ce3842a70c065a4087e1664e4377",
    "math_contract_sha256": "abfade5dadd1e34af40adca017648070e6af39f9fd84cae2add7b30fa3763a29",
    "math_decision_schema_sha256": "b3929312d94633c5fdebb68f2df705c51bdb2868fa4941b97993e0fd6a1c0cb1",
    "math_problem_schema_sha256": "3942db4a53405c57c8cf7edfcbcda26262b6457de80f55ca4620278ec0ae04fd",
    "outcomes_contract_sha256": "69f19bea1007183d8566b47d2a9a6015132f94832c3ec5abe2fb12367afae518",
    "outcomes_policy_sha256": "fba35b2df51769c558844792d84bff7270c970912464a2833e9f999d6cefd5e6",
    "outcomes_run_sha256": "6b3d6a91ba3397481ddb332f2ca2c37c8fab44f3de85b28a4e9e6ec2c764a0b2",
    "public_evaluator_contract_sha256": "0ccc1e20cdde7aea06cd29f7f0544856a9f715bebb7d6a1407472d812087bc98"
  },
  "bins": [
    {
      "bin_id": "B0",
      "lower": [
        0,
        1
      ],
      "upper": [
        1,
        5
      ],
      "upper_inclusive": false
    },
    {
      "bin_id": "B1",
      "lower": [
        1,
        5
      ],
      "upper": [
        2,
        5
      ],
      "upper_inclusive": false
    },
    {
      "bin_id": "B2",
      "lower": [
        2,
        5
      ],
      "upper": [
        3,
        5
      ],
      "upper_inclusive": false
    },
    {
      "bin_id": "B3",
      "lower": [
        3,
        5
      ],
      "upper": [
        4,
        5
      ],
      "upper_inclusive": false
    },
    {
      "bin_id": "B4",
      "lower": [
        4,
        5
      ],
      "upper": [
        1,
        1
      ],
      "upper_inclusive": true
    }
  ],
  "calibrator": {
    "alpha": 1,
    "beta": 1,
    "calibrator_id": "FIXED_BIN_BETA_BINOMIAL_ALPHA_1_BETA_1:V1",
    "fit_partition": "VALIDATION_COMPLETE_CANDIDATE_UNIVERSE_ONLY",
    "minimum_cell_count": 4,
    "registered_at": "2026-04-15T00:00:00Z",
    "test_reuse_allowed": false,
    "unseen_or_sparse_fallback": "UNKNOWN_INPUT",
    "validation_fit_at": "2026-07-07T00:00:00Z"
  },
  "claim_ceiling": "Synthetic calibration, missingness, subgroup, temporal, MATH projection, and abstention mechanics only; no real calibration, prediction, fairness, stability, causal lift, commercial value, production fitness, or authority.",
  "document_kind": "FROZEN_SYNTHETIC_CALIBRATION_INPUT",
  "execution_scope": "SYNTHETIC_NON_INFLUENCING",
  "probability_head": {
    "all_baseline_policy_streams_are_rank_only": true,
    "estimand_kind": "OBSERVATIONAL_CANDIDATE_RISK_NOT_CAUSAL_EFFECT_OR_ROUTE_DAY_ITT",
    "head_id": "BETA_BINOMIAL_BUCKET_RAW_POSTERIOR_SYNTHETIC_V1",
    "numeric_domain": "CANONICAL_REDUCED_EXACT_RATIONAL_0_TO_1_INCLUSIVE",
    "source_policy_id": "BETA_BINOMIAL_BUCKET_SYNTHETIC_V1",
    "target": "F9_WITHIN_REGISTERED_WINDOW_W_GIVEN_STAGE1_POINT_IN_TIME_INFORMATION"
  },
  "registered_at": "2026-04-15T00:00:00Z",
  "registry_id": "CALIBRATION_INPUT:FROZEN_V1",
  "scenarios": [
    {
      "probability_override": null,
      "scenario_id": "CANONICAL_ALL_PROBABILITIES_KNOWN"
    },
    {
      "probability_override": {
        "candidate_id": "CAND:SYN_BASE_07_01",
        "route_day_id": "ROUTE_DAY:SYN_BASE_07",
        "state": "UNKNOWN_INPUT"
      },
      "scenario_id": "UNKNOWN_ADMISSIBLE_PROBABILITY"
    },
    {
      "candidate_ids": [
        "CAND:SYN_BASE_07_01"
      ],
      "scenario_id": "SPARSE_OCCUPIED_RELIABILITY_CELL"
    },
    {
      "probability_override": {
        "candidate_id": "CAND:SYN_BASE_08_12",
        "market_segment": "UNKNOWN",
        "route_day_id": "ROUTE_DAY:SYN_BASE_08",
        "state": "UNKNOWN_INPUT"
      },
      "scenario_id": "MISSING_MODEL_FEATURE_AND_SUBGROUP"
    }
  ],
  "schema_version": "1.0.0"
}
